<?xml version="1.0" encoding="UTF-8"?>
<statement mainSchemaNamespace="http://www.meh.es/taxonomias/lenloc2-econ-ingr-abierta" mainSchemaPrefix="lenloc2-econ-ingr-abierta" name="lenloc2010-INGA" xmlns="http://www.inteco.es/xbrl/lenlocpenloc2010/map" xmlns:xsi="http://www.w3.org/2001/XMLSchema-instance" xsi:schemaLocation="http://www.inteco.es/xbrl/lenlocpenloc2010/map D:\proyectos\inteco\workspace\inteco_api_xbrl\config\schemas\lenlocpenloc2010-map.xsd">
	<conceptMap containerDimensionType="segment" domain="lenloc2-econ-ingr-abierta:FilasDimension" inputID="lenloc2-econ-ingr-abierta_CodigoDeCuenta" isTypedDimension="true" ns="http://www.meh.es/taxonomias/lenloc2-econ-ingr-abierta" nsPrefix="lenloc2-econ-ingr-abierta" outputID="CodigoDeCuenta">
        <member id="lenloc2-econ-ingr-abierta_FilasTipoDeDimension" qname="lenloc2-econ-ingr-abierta:FilasTipoDeDimension"/>	
    </conceptMap>
	<conceptMap containerDimensionType="segment" domain="lenloc2-econ-ingr-abierta:FilasDimension" inputID="lenloc2-econ-ingr-abierta_Descripcion" isTypedDimension="true" ns="http://www.meh.es/taxonomias/lenloc2-econ-ingr-abierta" nsPrefix="lenloc2-econ-ingr-abierta" outputID="Descripcion">
        <member id="lenloc2-econ-ingr-abierta_FilasTipoDeDimension" qname="lenloc2-econ-ingr-abierta:FilasTipoDeDimension"/>	
    </conceptMap>
	<conceptMap containerDimensionType="segment" domain="lenloc2-econ-ingr-abierta:FilasDimension" inputID="lenloc2-econ-ingr-importes_PrevisionDefinivaDelEjercicioCorriente" isTypedDimension="true" ns="http://www.meh.es/taxonomias/lenloc2-econ-ingr-importes" nsPrefix="lenloc2-econ-ingr-importes" outputID="PrevisionDefinivaDelEjercicioCorriente">
        <member id="lenloc2-econ-ingr-abierta_FilasTipoDeDimension" qname="lenloc2-econ-ingr-abierta:FilasTipoDeDimension"/>	
    </conceptMap>
	<conceptMap containerDimensionType="segment" domain="lenloc2-econ-ingr-abierta:FilasDimension" inputID="lenloc2-econ-ingr-importes_DerechosReconocidosDelEjercicioCorriente" isTypedDimension="true" ns="http://www.meh.es/taxonomias/lenloc2-econ-ingr-importes" nsPrefix="lenloc2-econ-ingr-importes" outputID="DerechosReconocidosDelEjercicioCorriente">
        <member id="lenloc2-econ-ingr-abierta_FilasTipoDeDimension" qname="lenloc2-econ-ingr-abierta:FilasTipoDeDimension"/>	
    </conceptMap>
	<conceptMap containerDimensionType="segment" domain="lenloc2-econ-ingr-abierta:FilasDimension" inputID="lenloc2-econ-ingr-importes_RecaudacionLiquidaDelEjercicioCorriente" isTypedDimension="true" ns="http://www.meh.es/taxonomias/lenloc2-econ-ingr-importes" nsPrefix="lenloc2-econ-ingr-importes" outputID="RecaudacionLiquidaDelEjercicioCorriente">
        <member id="lenloc2-econ-ingr-abierta_FilasTipoDeDimension" qname="lenloc2-econ-ingr-abierta:FilasTipoDeDimension"/>	
    </conceptMap>
	<conceptMap containerDimensionType="segment" domain="lenloc2-econ-ingr-abierta:FilasDimension" inputID="lenloc2-econ-ingr-importes_RecaudacionLiquidaDeEjerciciosCerrados" isTypedDimension="true" ns="http://www.meh.es/taxonomias/lenloc2-econ-ingr-importes" nsPrefix="lenloc2-econ-ingr-importes" outputID="RecaudacionLiquidaDeEjerciciosCerrados">
        <member id="lenloc2-econ-ingr-abierta_FilasTipoDeDimension" qname="lenloc2-econ-ingr-abierta:FilasTipoDeDimension"/>	
    </conceptMap>
</statement>
